{
  "$schema": "http://json-schema.org/draft-07/schema#",
  "$id": "https://raw.githubusercontent.com/jordachmakaya/index-ai/v1.0-rc2/schema/v1/agent-index.schema.json",
  "title": "index-ai Agent Index",
  "description": "Level 2 Agent View served at the URL declared in access.agent_index (default /agent-index.json). Field requirements follow the specification (SPEC-v1.0-rc2 §7): generated, spec_version, and nodes are required; node label, description, meta, and content summary_method/language are optional. The $id points at the immutable v1.0-rc2 tag — published versions never change (SPEC §17.2). This schema is STRUCTURAL: referential integrity (every referenced id must exist), llm_summary word counts, freshness, and SSRF are enforced by the reference validator and the conformance test suite.",
  "type": "object",
  "required": ["generated", "spec_version", "nodes"],
  "additionalProperties": true,
  "properties": {
    "$schema": {
      "type": "string",
      "description": "Optional JSON Schema reference URL."
    },
    "generated": {
      "type": "string",
      "format": "date-time",
      "description": "REQUIRED. ISO 8601 datetime of Agent View generation."
    },
    "spec_version": {
      "type": "string",
      "pattern": "^[0-9]+\\.[0-9]+(\\.[0-9]+)?(-[0-9A-Za-z.-]+)?$",
      "description": "REQUIRED. index-ai spec version this Agent View targets (e.g. \"1.0-rc2\"). Must be a version string, not free text."
    },
    "total_nodes": {
      "type": "integer",
      "minimum": 0,
      "description": "RECOMMENDED. Total node count across all pages (including paginated)."
    },
    "returned_nodes": { "type": "integer", "minimum": 0 },
    "offset": { "type": "integer", "minimum": 0 },
    "limit": { "type": "integer", "minimum": 1 },
    "next_offset": { "type": ["integer", "null"] },
    "nodes": {
      "type": "array",
      "description": "REQUIRED. Array of content nodes.",
      "items": { "$ref": "#/definitions/node" }
    }
  },
  "definitions": {
    "node": {
      "type": "object",
      "required": ["id", "type", "content"],
      "additionalProperties": true,
      "properties": {
        "id": { "type": "string", "minLength": 1 },
        "type": { "type": "string", "minLength": 1 },
        "label": { "type": "string", "description": "OPTIONAL." },
        "description": { "type": "string", "description": "OPTIONAL." },
        "content": {
          "type": "object",
          "required": ["llm_summary"],
          "additionalProperties": true,
          "properties": {
            "llm_summary": { "type": "string", "minLength": 1 },
            "llm_url": { "type": "string", "minLength": 1, "description": "RECOMMENDED. Clean text endpoint." },
            "content_chars": { "type": "integer", "minimum": 1, "description": "OPTIONAL. NFC code point count at llm_url." },
            "content_chars_mode": { "enum": ["exact", "max"], "description": "MUST be present when content_chars is present." },
            "content_sha256": { "type": "string", "pattern": "^[a-f0-9]{64}$", "description": "OPTIONAL. Lowercase hex SHA-256 of the NFC-normalized content. Valid only with content_chars_mode: \"exact\" (SPEC §7.6)." },
            "content_version": { "type": "string", "description": "OPTIONAL. Opaque content-version label." },
            "content_chars_measurement": {
              "type": "object",
              "additionalProperties": true,
              "properties": {
                "window_seconds": { "type": "integer", "minimum": 1 },
                "measured_at": { "type": "string", "format": "date-time" }
              }
            },
            "summary_method": { "enum": ["manual", "truncate", "llm"], "description": "RECOMMENDED." },
            "language": { "type": "string", "pattern": "^[a-z]{2}$", "description": "OPTIONAL. ISO 639-1 code (two lowercase letters)." }
          },
          "dependencies": {
            "content_chars": ["llm_url", "content_chars_mode"]
          },
          "if": {
            "required": ["content_sha256"]
          },
          "then": {
            "required": ["content_chars", "content_chars_mode"],
            "properties": { "content_chars_mode": { "const": "exact" } }
          }
        },
        "meta": {
          "type": "object",
          "additionalProperties": true,
          "description": "OPTIONAL."
        },
        "relations": {
          "type": "object",
          "additionalProperties": true,
          "description": "OPTIONAL (Level 2b only). Referential integrity (every referenced id must exist) is enforced by the validator and the conformance suite, not by JSON Schema alone.",
          "properties": {
            "parent": { "type": ["string", "null"], "description": "id of the parent node, or null for a root node." },
            "children": { "type": "array", "items": { "type": "string" }, "description": "ids of child nodes." },
            "related": { "type": "array", "items": { "type": "string" }, "description": "ids of related nodes (not parent/child)." }
          }
        }
      }
    }
  }
}
